{
  "$schema": "https://json-schema.org/draft/2020-12/schema",
  "$id": "https://ctxql.example/schemas/p5-7/non-interference-evidence-v1.schema.json",
  "type": "object",
  "additionalProperties": false,
  "required": ["$schema", "schema", "profile", "registered_family_count", "direct_test", "official_scope_test", "scopes", "comparison", "result"],
  "properties": {
    "$schema": {"const": "https://json-schema.org/draft/2020-12/schema"},
    "schema": {"const": "ctxql.p5-7-non-interference-evidence/v1"},
    "profile": {"const": "ctxql-ontology-profile/fluree-4.2-603974fad5c13efed9d147d214d613849fb43c73/v3-supported-subset"},
    "registered_family_count": {"const": 14},
    "direct_test": {"const": "every_registered_family_is_directly_inference_inert"},
    "official_scope_test": {"const": "complete_official_scopes_are_directly_inference_inert"},
    "scopes": {"const": ["FND/Relations/Relations", "FND/Agreements/Agreements"]},
    "comparison": {"const": ["supported_iri_facts", "normalized_public_diagnostics"]},
    "result": {"const": "pass"}
  }
}
